[
  {
    "abilityIds": [
      "ability-034",
      "ability-065"
    ],
    "available": true,
    "form": {
      "kind": "base"
    },
    "id": "pokemon-0003000",
    "identity": true,
    "name": "Venusaur",
    "sex": "mixed",
    "speciesId": "species-003",
    "stats": {
      "attack": 82,
      "defense": 83,
      "hp": 80,
      "spAttack": 100,
      "spDefense": 100,
      "speed": 80
    },
    "typeIds": [
      "grass",
      "poison"
    ],
    "weightKg": 100
  },
  {
    "abilityIds": [
      "ability-047"
    ],
    "available": true,
    "form": {
      "kind": "mega"
    },
    "id": "pokemon-0003001",
    "identity": true,
    "name": "Mega-Venusaur",
    "sex": "mixed",
    "speciesId": "species-003",
    "stats": {
      "attack": 100,
      "defense": 123,
      "hp": 80,
      "spAttack": 122,
      "spDefense": 120,
      "speed": 80
    },
    "typeIds": [
      "grass",
      "poison"
    ],
    "weightKg": 155.5
  },
  {
    "abilityIds": [
      "ability-066",
      "ability-094"
    ],
    "available": true,
    "form": {
      "kind": "base"
    },
    "id": "pokemon-0006000",
    "identity": true,
    "name": "Charizard",
    "sex": "mixed",
    "speciesId": "species-006",
    "stats": {
      "attack": 84,
      "defense": 78,
      "hp": 78,
      "spAttack": 109,
      "spDefense": 85,
      "speed": 100
    },
    "typeIds": [
      "fire",
      "flying"
    ],
    "weightKg": 90.5
  },
  {
    "abilityIds": [
      "ability-181"
    ],
    "available": true,
    "form": {
      "kind": "mega"
    },
    "id": "pokemon-0006001",
    "identity": true,
    "name": "Mega-Charizard X",
    "sex": "mixed",
    "speciesId": "species-006",
    "stats": {
      "attack": 130,
      "defense": 111,
      "hp": 78,
      "spAttack": 130,
      "spDefense": 85,
      "speed": 100
    },
    "typeIds": [
      "dragon",
      "fire"
    ],
    "weightKg": 110.5
  },
  {
    "abilityIds": [
      "ability-070"
    ],
    "available": true,
    "form": {
      "kind": "mega"
    },
    "id": "pokemon-0006002",
    "identity": true,
    "name": "Mega-Charizard Y",
    "sex": "mixed",
    "speciesId": "species-006",
    "stats": {
      "attack": 104,
      "defense": 78,
      "hp": 78,
      "spAttack": 159,
      "spDefense": 115,
      "speed": 100
    },
    "typeIds": [
      "fire",
      "flying"
    ],
    "weightKg": 100.5
  },
  {
    "abilityIds": [
      "ability-044",
      "ability-067"
    ],
    "available": true,
    "form": {
      "kind": "base"
    },
    "id": "pokemon-0009000",
    "identity": true,
    "name": "Blastoise",
    "sex": "mixed",
    "speciesId": "species-009",
    "stats": {
      "attack": 83,
      "defense": 100,
      "hp": 79,
      "spAttack": 85,
      "spDefense": 105,
      "speed": 78
    },
    "typeIds": [
      "water"
    ],
    "weightKg": 85.5
  },
  {
    "abilityIds": [
      "ability-178"
    ],
    "available": true,
    "form": {
      "kind": "mega"
    },
    "id": "pokemon-0009001",
    "identity": true,
    "name": "Mega-Blastoise",
    "sex": "mixed",
    "speciesId": "species-009",
    "stats": {
      "attack": 103,
      "defense": 120,
      "hp": 79,
      "spAttack": 135,
      "spDefense": 115,
      "speed": 78
    },
    "typeIds": [
      "water"
    ],
    "weightKg": 101.1
  },
  {
    "abilityIds": [
      "ability-068",
      "ability-097"
    ],
    "available": true,
    "form": {
      "kind": "base"
    },
    "id": "pokemon-0015000",
    "identity": true,
    "name": "Beedrill",
    "sex": "mixed",
    "speciesId": "species-015",
    "stats": {
      "attack": 90,
      "defense": 40,
      "hp": 65,
      "spAttack": 45,
      "spDefense": 80,
      "speed": 75
    },
    "typeIds": [
      "bug",
      "poison"
    ],
    "weightKg": 29.5
  },
  {
    "abilityIds": [
      "ability-091"
    ],
    "available": true,
    "form": {
      "kind": "mega"
    },
    "id": "pokemon-0015001",
    "identity": true,
    "name": "Mega-Beedrill",
    "sex": "mixed",
    "speciesId": "species-015",
    "stats": {
      "attack": 150,
      "defense": 40,
      "hp": 65,
      "spAttack": 15,
      "spDefense": 80,
      "speed": 145
    },
    "typeIds": [
      "bug",
      "poison"
    ],
    "weightKg": 40.5
  },
  {
    "abilityIds": [
      "ability-051",
      "ability-077",
      "ability-145"
    ],
    "available": true,
    "form": {
      "kind": "base"
    },
    "id": "pokemon-0018000",
    "identity": true,
    "name": "Pidgeot",
    "sex": "mixed",
    "speciesId": "species-018",
    "stats": {
      "attack": 80,
      "defense": 75,
      "hp": 83,
      "spAttack": 70,
      "spDefense": 70,
      "speed": 101
    },
    "typeIds": [
      "flying",
      "normal"
    ],
    "weightKg": 39.5
  },
  {
    "abilityIds": [
      "ability-099"
    ],
    "available": true,
    "form": {
      "kind": "mega"
    },
    "id": "pokemon-0018001",
    "identity": true,
    "name": "Mega-Pidgeot",
    "sex": "mixed",
    "speciesId": "species-018",
    "stats": {
      "attack": 80,
      "defense": 80,
      "hp": 83,
      "spAttack": 135,
      "spDefense": 80,
      "speed": 121
    },
    "typeIds": [
      "flying",
      "normal"
    ],
    "weightKg": 50.5
  },
  {
    "abilityIds": [
      "ability-022",
      "ability-061",
      "ability-127"
    ],
    "available": true,
    "form": {
      "kind": "base"
    },
    "id": "pokemon-0024000",
    "identity": true,
    "name": "Arbok",
    "sex": "mixed",
    "speciesId": "species-024",
    "stats": {
      "attack": 95,
      "defense": 69,
      "hp": 60,
      "spAttack": 65,
      "spDefense": 79,
      "speed": 80
    },
    "typeIds": [
      "poison"
    ],
    "weightKg": 65
  },
  {
    "abilityIds": [
      "ability-009",
      "ability-031"
    ],
    "available": true,
    "form": {
      "kind": "base"
    },
    "id": "pokemon-0025000",
    "identity": true,
    "name": "Pikachu",
    "sex": "mixed",
    "speciesId": "species-025",
    "stats": {
      "attack": 55,
      "defense": 40,
      "hp": 35,
      "spAttack": 50,
      "spDefense": 50,
      "speed": 90
    },
    "typeIds": [
      "electric"
    ],
    "weightKg": 6
  },
  {
    "abilityIds": [
      "ability-009",
      "ability-031"
    ],
    "available": true,
    "form": {
      "kind": "base"
    },
    "id": "pokemon-0026000",
    "identity": true,
    "name": "Raichu",
    "sex": "mixed",
    "speciesId": "species-026",
    "stats": {
      "attack": 90,
      "defense": 55,
      "hp": 60,
      "spAttack": 90,
      "spDefense": 80,
      "speed": 110
    },
    "typeIds": [
      "electric"
    ],
    "weightKg": 30
  },
  {
    "abilityIds": [
      "ability-207"
    ],
    "available": true,
    "form": {
      "kind": "regional"
    },
    "id": "pokemon-0026001",
    "identity": true,
    "sex": "mixed",
    "speciesId": "species-026",
    "stats": {
      "attack": 85,
      "defense": 50,
      "hp": 60,
      "spAttack": 95,
      "spDefense": 85,
      "speed": 110
    },
    "typeIds": [
      "electric",
      "psychic"
    ],
    "weightKg": 21
  },
  {
    "abilityIds": [
      "ability-226"
    ],
    "available": true,
    "form": {
      "kind": "mega"
    },
    "id": "pokemon-0026002",
    "identity": true,
    "name": "Mega-Raichu X",
    "sex": "mixed",
    "speciesId": "species-026",
    "stats": {
      "attack": 135,
      "defense": 95,
      "hp": 60,
      "spAttack": 90,
      "spDefense": 95,
      "speed": 110
    },
    "typeIds": [
      "electric"
    ],
    "weightKg": 38
  },
  {
    "abilityIds": [
      "ability-099"
    ],
    "available": true,
    "form": {
      "kind": "mega"
    },
    "id": "pokemon-0026003",
    "identity": true,
    "name": "Mega-Raichu Y",
    "sex": "mixed",
    "speciesId": "species-026",
    "stats": {
      "attack": 100,
      "defense": 55,
      "hp": 60,
      "spAttack": 160,
      "spDefense": 80,
      "speed": 130
    },
    "typeIds": [
      "electric"
    ],
    "weightKg": 26
  },
  {
    "abilityIds": [
      "ability-056",
      "ability-098",
      "ability-109"
    ],
    "available": true,
    "form": {
      "kind": "base"
    },
    "id": "pokemon-0036000",
    "identity": true,
    "name": "Clefable",
    "sex": "mixed",
    "speciesId": "species-036",
    "stats": {
      "attack": 70,
      "defense": 73,
      "hp": 95,
      "spAttack": 95,
      "spDefense": 90,
      "speed": 60
    },
    "typeIds": [
      "fairy"
    ],
    "weightKg": 40
  },
  {
    "abilityIds": [
      "ability-156"
    ],
    "available": true,
    "form": {
      "kind": "mega"
    },
    "id": "pokemon-0036001",
    "identity": true,
    "name": "Mega-Clefable",
    "sex": "mixed",
    "speciesId": "species-036",
    "stats": {
      "attack": 80,
      "defense": 93,
      "hp": 95,
      "spAttack": 135,
      "spDefense": 110,
      "speed": 70
    },
    "typeIds": [
      "fairy",
      "flying"
    ],
    "weightKg": 42.3
  },
  {
    "abilityIds": [
      "ability-018",
      "ability-070"
    ],
    "available": true,
    "form": {
      "kind": "base"
    },
    "id": "pokemon-0038000",
    "identity": true,
    "name": "Ninetales",
    "sex": "mixed",
    "speciesId": "species-038",
    "stats": {
      "attack": 76,
      "defense": 75,
      "hp": 73,
      "spAttack": 81,
      "spDefense": 100,
      "speed": 100
    },
    "typeIds": [
      "fire"
    ],
    "weightKg": 19.9
  },
  {
    "abilityIds": [
      "ability-081",
      "ability-117"
    ],
    "available": true,
    "form": {
      "kind": "regional"
    },
    "id": "pokemon-0038001",
    "identity": true,
    "sex": "mixed",
    "speciesId": "species-038",
    "stats": {
      "attack": 67,
      "defense": 75,
      "hp": 73,
      "spAttack": 81,
      "spDefense": 100,
      "speed": 109
    },
    "typeIds": [
      "fairy",
      "ice"
    ],
    "weightKg": 19.9
  },
  {
    "abilityIds": [